<?xml version="1.0" encoding="UTF-8"?>
<!DOCTYPE test SYSTEM "testdescription.dtd">

<test>
	<tryToConnect userName="BIENEMAJA1" password="PUPS" expectError="TRUE"/>
	<tryToConnect userName="BIENEMAJA2" password="PUPS" expectError="FALSE"/>
	<tryToConnect userName="BIENEMAJA3" password="PUPS" expectError="TRUE"/>
	<tryToConnect userName="BIENEMAJA4" password="PUPS" expectError="FALSE"/>
	<tryToConnect userName="BIENEMAJA5" password="PUPS" expectError="TRUE"/>
	<tryToConnect userName="BIENEMAJA6" password="PUPS" expectError="TRUE"/>

	<tryToConnect userName="WILLI1" password="PUPS" expectError="FALSE"/>
	<tryToConnect userName="WILLI2" password="PUPS" expectError="TRUE"/>
	<tryToConnect userName="WILLI3" password="PUPS" expectError="FALSE"/>
	<tryToConnect userName="WILLI4" password="PUPS" expectError="TRUE"/>
	<tryToConnect userName="WILLI5" password="PUPS" expectError="TRUE"/>
	<tryToConnect userName="WILLI6" password="PUPS" expectError="TRUE"/>


	<thread sequence = "innerTransactionUser4cleanUp.xml" userName="UWEHEINZ4" create="FALSE"/>

</test>